{
  "schemaVersion": "1.0.0",
  "storyId": "3735081",
  "startedAt": "2026-09-11T10:00:00Z",
  "agent": "ei-graphics",
  "verbosity": "verbose",
  "entries": [
    {
      "timestamp": "2026-09-11T10:00:01Z",
      "phase": "implementation",
      "action": "trace-content-assignment-history",
      "reasoning": "This statement came from the repository's local Git history, not from the Azure DevOps story.\n\nEvidence used:\n\n git log --all --oneline -S \"IsContentAssignmentUpdated\" -- Data/Aveva.EI.Repositories/CanvasDrawingsRepository.cs Presentation/Aveva.EI.CanvasDrawings/SGCClient/CanvasEventManager.cs\n\nThis identified commit 56f69e11583, titled Merged PR 921114: Termination drawing update and performance, related work item #4029829.\n\nThen git blame -L 1037,1048 Presentation/Aveva.EI.CanvasDrawings/SGCClient/CanvasEventManager.cs showed that the activation-time content-assignment check was added in that commit. I also inspected git show 56f69e11583 -- ... and saw the repository history-checking method and drawing refresh path introduced together.\n\nThe precise conclusion is that Git history confirms this refresh mechanism was introduced as part of an earlier termination-drawing content-assignment feature and exists in the current branch. It does not prove that work item 3735081 is fully verified or that the existing implementation satisfies every scenario in that story.",
      "outcome": "Recorded historical provenance separately from validation.",
      "durationMs": 1200,
      "tokensUsed": 800,
      "filesRead": [
        "Data/Aveva.EI.Repositories/CanvasDrawingsRepository.cs",
        "Presentation/Aveva.EI.CanvasDrawings/SGCClient/CanvasEventManager.cs"
      ],
      "evidence": [
        {
          "file": "Presentation/Aveva.EI.CanvasDrawings/SGCClient/CanvasEventManager.cs",
          "line": 1042,
          "symbol": "IsContentAssignmentUpdated",
          "quote": "if (_canvasEventModel.CanvasDrawingsService.IsContentAssignmentUpdated(...))\n{\n    return true;\n}"
        }
      ],
      "status": "informational"
    },
    {
      "timestamp": "2026-09-11T10:00:03Z",
      "phase": "validation",
      "action": "run-targeted-tests",
      "reasoning": null,
      "outcome": "Compile and targeted tests are recorded separately from Git history.",
      "durationMs": 4000,
      "tokensUsed": 400
    }
  ]
}
